{
  "$schema": "http://json-schema.org/draft-07/schema#",
  "title": "BlackRoad Product",
  "description": "Canonical record for one of the 27 BlackRoad OS products. This registry is the single source of truth; index.html is generated from it via scripts/sync-products.mjs.",
  "type": "object",
  "additionalProperties": false,
  "required": [
    "number", "id", "slug", "name", "role", "status",
    "meaning", "does", "org", "domain", "agents", "receipts", "carkeys", "next"
  ],
  "properties": {
    "number": { "type": "string", "pattern": "^[0-9]{2}$", "description": "Two-digit canon position, 01-27." },
    "id": { "type": "string", "pattern": "^[a-z0-9]+$", "description": "Stable lowercase identifier used by the UI." },
    "slug": { "type": "string", "pattern": "^[a-z0-9]+$", "description": "URL slug; equals id." },
    "name": { "type": "string" },
    "role": { "type": "string", "description": "One-line role of the product." },
    "status": { "enum": ["active", "next", "planned", "mvp-stub"], "description": "Honest build status. No fake 'done' without receipts." },
    "meaning": { "type": "string", "description": "What the product means / is for." },
    "does": { "type": "array", "items": { "type": "string" }, "description": "Capabilities. For PLANNED products these are intent, not promises." },
    "org": { "type": "string", "description": "Primary owning organization." },
    "domain": { "type": "string", "description": "Primary root domain." },
    "agents": { "type": "array", "items": { "type": "string" }, "description": "Primary agents wired to this product." },
    "receipts": { "type": "array", "items": { "type": "string" }, "description": "Receipt event names this product emits." },
    "carkeys": { "type": "array", "items": { "type": "string" }, "description": "CarKeys permission gates required." },
    "next": { "type": "string", "description": "Next concrete action." },

    "category": { "type": "string", "description": "Optional grouping, e.g. 'Operating Spine'." },
    "definition": { "type": "string", "description": "Optional longer canon definition." },
    "boundary": { "type": "string", "description": "Optional scope boundary vs adjacent products." },
    "mvp": { "type": "string", "description": "Optional MVP description." },
    "implementation_status": { "enum": ["planned", "mock", "partial", "real", "blocked"], "description": "Optional finer-grained build state." },
    "risk_level": { "enum": ["low", "medium", "high"] },
    "primary_handoff": { "type": "string", "description": "Optional: products this hands context off to." }
  }
}
