{
  "number": "01",
  "id": "roados",
  "slug": "roados",
  "name": "RoadOS",
  "role": "browser-native computer",
  "status": "active",
  "meaning": "browser-native computer",
  "does": [
    "shell + folder nav",
    "window management",
    "app routing",
    "system clock + chat"
  ],
  "org": "BlackRoad-OS-Primary",
  "domain": "blackroad.io",
  "agents": [
    "Lucidia",
    "Roadie",
    "Aria",
    "Silas"
  ],
  "receipts": [
    "roados.boot",
    "roados.window.opened",
    "roados.app.routed"
  ],
  "carkeys": [
    "none"
  ],
  "next": "wire command routing",
  "category": "Operating Spine",
  "definition": "Browser-native BlackRoad computer. One-tab operating environment.",
  "boundary": "RoadOS is the workspace/computer shell. RoadCode builds inside it.",
  "mvp": "Route a command/intent to the right product/file/action and give a safe next step.",
  "implementation_status": "planned",
  "risk_level": "medium",
  "primary_handoff": "RoadCode, RoadTrip, RoadView"
}
