{
  "number": "05",
  "id": "roadwork",
  "slug": "roadwork",
  "name": "RoadWork",
  "role": "work-in-progress board",
  "status": "planned",
  "meaning": "in-progress projects board",
  "does": [
    "WIP board",
    "blockers",
    "ETAs"
  ],
  "org": "BlackRoad-OS-Primary",
  "domain": "roadwork.blackroad.io",
  "agents": [
    "Celeste",
    "Octavia",
    "Roadie"
  ],
  "receipts": [
    "roadwork.task.added",
    "roadwork.blocker.flagged"
  ],
  "carkeys": [
    "none"
  ],
  "next": "scope MVP"
}
