{
  "number": "03",
  "id": "roadtrip",
  "slug": "roadtrip",
  "name": "RoadTrip",
  "role": "parallel agent lanes",
  "status": "planned",
  "meaning": "parallel agent lanes for long tasks",
  "does": [
    "lane orchestration",
    "agent handoffs",
    "progress tracking"
  ],
  "org": "BlackRoad-Agents",
  "domain": "trip.blackroad.io",
  "agents": [
    "Lucidia",
    "Octavia",
    "Sebastian",
    "Roadie"
  ],
  "receipts": [
    "roadtrip.lane.started",
    "roadtrip.handoff"
  ],
  "carkeys": [
    "agent dispatch gated"
  ],
  "next": "scope MVP"
}
