{
  "number": "09",
  "id": "roadworld",
  "slug": "roadworld",
  "name": "RoadWorld",
  "role": "public / world-facing",
  "status": "planned",
  "meaning": "public landing / world view",
  "does": [
    "public site",
    "marketing surface"
  ],
  "org": "BlackRoad-OS-Primary",
  "domain": "blackroad.io",
  "agents": [
    "Calliope",
    "Cicero",
    "Sapphira"
  ],
  "receipts": [
    "roadworld.page.published"
  ],
  "carkeys": [
    "none"
  ],
  "next": "scope MVP"
}
